Name,Nicknames,Country,Proven_victims,Possible_victims,Years_active,Start_year,End_year,Conviction,Criminal_Penalty,Notes,Weapon,Gender,Weapon_Category
Juan Corona,Corona,United States,25.0,25.0,9.0,1971.0,1980.0,Murder,life imprisonment,Corona was convicted of murdering ranch laborers and burying them in orchards. He was sentenced to 25 terms life imprisonment. Died from natural causes in 2019.,"pistol, knife, stabbed, machete, truck",male,Firearm
Juan Covington,,United States,3.0,3.0,7.0,1998.0,2005.0,Murder,life imprisonment x3,Shot and killed 3 people.,"gun, pistol, shot, shooting",male,Firearm
Juan Fernando Hermosa,Niño del Terror-Child of Terror,Ecuador,23.0,23.0,1.0,1991.0,1992.0,Murder,4 years imprisonment,"Known as ""Niño del Terror""; youth gang leader who murdered mostly taxi drivers and homosexuals in Quito; murdered on his 20th birthday by unknown assailants.","gun, revolver, pistol, shot, shooting, vehicle, truck",male,Firearm
Juana Barraza,"Mataviejitas(Sp. Little Old Lady Killer, )La Dama del Silencio(Sp. The Lady of Silence)",Mexico,16.0,49.0,9.0,1997.0,2006.0,,759 years,Mexican female wrestler who bludgeoned or strangled elderly women to rob them. Sentenced to 759 years.,strangled,female,Strangulation
Judy Buenoano,"Judias Goodyear, Judy Morris, Judias Buenoano, Judy Goodyear, Judias Morris",United States,3.0,5.0,9.0,1971.0,1980.0,Murder,"life imprisonment (June 6, 1984)deathby electric chair (November 26, 1985)","Poisoned her husband, boyfriend and son with arsenic; drowned the son in 1980 but caught in 1983 after poisoning and car bombing a fiancée.","poison, arsenic, drowned, car",female,Poison
Julio Perez Silva,The Psychopath of Alto Hospicio,Chile,14.0,19.0,3.0,1998.0,2001.0,Murder,life imprisonment with the possibility of parole after 40 years imprisonment (murder)20 years imprisonment (rape)10 years imprisonment (attempted murder),Known as The Psychopath from Alto Hospicio; killed 14 women. Sentenced to life imprisonment in 2004.,knife,male,Blade
Jurgen Bartsch,The Carnival Killer (Der Kirmesmörder),Germany,4.0,4.0,4.0,1962.0,1966.0,Murder,"life imprisonment, commuted 10 years of juvenile detention","Killed four, one escaped; died by wrongful overdose during castration surgery.",unknown,male,Unknown
Kampatimar Shankariya,,India,70.0,70.0,1.0,1977.0,1978.0,Murder,death,"Shankariya was an Indian serial killer who used a hammer to kill over 70 men and women between 1978 and 1979. He was hanged in 1979; his last words were, ""I have murdered in vain"", he declared. ""Nobody should become like me.""","hammer, hanged",male,Blunt Object
Kang Ho-Sun,,South Korea,10.0,10.0,2.0,2006.0,2008.0,,,"Sentenced to death in 2010 for killing 10 women, including his wife and mother-in-law.",hanging,female,Hanging
Karl Denke,"Father Denke, Papa Denke, The Cannibal of Münsterberg, The Forgotten Cannibal",Germany,30.0,42.0,24.0,1900.0,1924.0,,,"Killed and cannibalized poor travelers and homeless vagrants. Kept a ledger recording his murders with at least 31 names in it (including Vincenz Olivier, his only surviving victim), thus confirming at least 30 victims. But due to the massive amount of human remains found in his apartment, his kill count is suspected by many to exceed 42 victims. Killed himself by hanging in his holding cell before he could be tried.",hanged,male,Hanging
Karl F. Warner,,United States,3.0,3.0,2.0,1969.0,1971.0,Murder,life imprisonment,"Convicted of murdering three teenage girls, in two separate incidents, in the San Francisco Bay Area communities of San Jose and Saratoga, he was briefly suspected of being the notorious Zodiac Killer, but was soon ruled out as a suspect in that case.","knife, stabbed, stabbing",female,Blade
Kaspars Petrovs,,Latvia,13.0,38.0,9.0,2003.0,2012.0,Murder,Life,"Confessed to strangling 38 elderly residents of Riga, Latvia, in 2003. Convicted and sentenced to life imprisonment for the robbery and murder of 13.",strangled,male,Strangulation
Keith Hunter Jesperson,,United States,8.0,160.0,5.0,1990.0,1995.0,,life imprisonment (without parole),"Dubbed the ""Happy Face Killer"", Jesperson was convicted of killing eight women by strangulation.","strangled, strangulation, hanged, truck",female,Strangulation
Kendall Francois,"The Poughkeepsie Killer, Stinky",United States,8.0,9.0,2.0,1996.0,1998.0,Murder,life imprisonment without parole,"Admitted to killing eight sex workers in Poughkeepsie, New York, but denied involvement with the disappearance of a ninth prostitute.","choked, drowned, car",male,Strangulation
Kenneth Bianchi,The Hillside Strangler,United States,12.0,15.0,1.0,1977.0,1978.0,Murder,life imprisonment,"Convicted of strangling 12 female victims aged 12 to 28 and suspected in another three cases. One of the ""Hillside Stranglers"". Sentenced to imprisonment for life.",club,male,Blunt Object
Kenneth Erskine,The Stockwell Strangler,United Kingdom,7.0,11.0,9.0,1986.0,1995.0,,Detention at Broadmoor Hospital but moved to Thornford Park Hospital,"Known as ""The Stockwell Strangler"", he was a burglar who raped and strangled at least seven elderly women after breaking into their homes.",strangled,male,Strangulation
Kenneth Mcduff,,United States,9.0,14.0,26.0,1966.0,1992.0,,,"Known as ""The Broomstick Killer""; death sentence for 1966 triple-murder was commuted. Killed again three days after 1989 parole and 10 further times in Waco, Texas until 1992. Executed by lethal injection in 1998.","gun, firearm, revolver, pistol, strangled, choked, fire, car, vehicle, truck, tortured",female,Firearm
Kermit Gosnell,,United States,48.0,200.0,15.0,1995.0,2010.0,Murder Conspiracy,"Federal, 30 years imprisonmentPennsylvaniaThree consecutive life sentence(s) without the possibility of parole","Kermit Gosnell is an American serial-killer and former physician who ran an abortion clinic known as the ""House of Horrors."" Authorities discovered the remains of at least 47 late-term aborted children stored in bags or cartons, several of which appeared to be killed after birth. He was convicted in 2011 for 3 counts of first-degree murder of babies he delivered alive and then severed the spinal cords of, 1 count of manslaughter for the death of a woman he performed an abortion on, and over 200 counts of other abortion-related laws. Testimony indicated hundreds of similar procedures carried out by Gosnell and his staff.",razor,male,Blade
Khalil Wheeler-Weaver,,United States,3.0,4.0,9.0,2016.0,2025.0,Murder Kidnapping Rape,160 years imprisonment,"American serial killer from Orange, New Jersey, Wheeler-Weaver lured his victims using dating apps and murdered three women and attempted to kill a fourth between August 2016 and November 2016. One of the victim's friends created a fake account and lured him to a meeting before notifying police.","strangled, poison",female,Strangulation
Kimberly Clark Saenz,,United States,5.0,5.0,9.0,2008.0,2017.0,Murder,Life plus 60 years,Killed five patients by using syringes to inject bleach into their dialysis lines.,"fire, acid",female,Fire
Kimberly Mccarthy,,United States,3.0,3.0,9.0,1988.0,1997.0,,,"Executed for murdering her neighbour, 71-year-old Dorothy Booth; DNA evidence proved she had murdered two other elderly women, but she was never charged.","knife, stabbed",female,Blade
Kiss Brothers And Zsolt Istvan Peto,,Hungary,6.0,6.0,1.0,2008.0,2009.0,,,"A series of murders perpetrated by three Neo-Nazis (with an accomplice István Csaba Csontos) against people of Roma ethnicity, occurring between July 2008 and August 2009. It is regarded as one of the worst crimes in the country's history after the war.",gunshot,male,Firearm
Kiyoshi Okubo,"Gunma,s Stalin",Japan,8.0,8.0,9.0,1971.0,1980.0,,death,"Raped and murdered eight women aged 17 to 21 upon his release from prison, where he had been for previous rapes. Hanged in 1976.","hanging, car",male,Vehicle
Kiyotaka Katsuta,Kiyotaka Fujiwara,Japan,8.0,22.0,1.0,1982.0,1983.0,Murder,death,"Strangled or shot people to rob them, using a gun he had stolen from a policeman after running him over with his car. Hanged in 2000.","shot, shooting, car",male,Firearm
Koos Hertogs,,Netherlands,3.0,12.0,1.0,1979.0,1980.0,,life imprisonment,"Dutch serial killer convicted of abducting, torturing, raping and killing three girls. Suspected of killing a further three to nine girls and young women in the 1970s.",unknown,male,Unknown
Kotakethana Murders,,Sri Lanka,18.0,18.0,7.0,2008.0,2015.0,,,18 mysterious murders of women in the Rathnapura district of Sri Lanka. One middle age man suspect was arrested in 2015 and his DNA matched with six murders. Nine other cases remain unsolved.,unknown,male,Unknown
Kristen Gilbert,The Angel of Death,United States,5.0,70.0,6.0,1990.0,1996.0,Murder,"Four consecutive life sentence(s) without parole, plus 20 years","Nurse at a Massachusetts Veterans Medical Center who injected male patients with epinephrine, causing heart attacks. Sentenced to life without parole.","knife, poison, bomb",female,Blade
Lainz Angels Of Death,,Austria,15.0,124.0,6.0,1983.0,1989.0,,,"Known as the ""Lainz Angels of Death""; Waltraud Wagner, Irene Leidolf, Stephanija Mayer, and Maria Gruber were nurses at the Lainz General Hospital in Vienna who admitted to murdering 49 patients.",drowned,female,Drowning
Lam Kor-Wan,,Hong Kong,4.0,4.0,2.0,1980.0,1982.0,,,Taxi driver and one of Hong Kong's only two known serial killers. Famous for keeping body parts in his parents' home.,"knife, club, strangled, hanging, car",male,Blade
Lam Kwok-Wai,,Hong Kong,3.0,3.0,9.0,1993.0,2002.0,,,Convicted of 10 rapes and 3 murders that he committed with his bare hands. One of two only known serial killers in Hong Kong.,unknown,male,Unknown
Larry Eyler,"The Highway Killer, The Interstate Killer",United States,19.0,23.0,2.0,1982.0,1984.0,Murder,"Illinois, death(October 3, 1986)Indiana, 60 years imprisonment (December 28, 1990)","Known as ""The Interstate Killer""; sentenced to death for the 1984 murder and dismemberment of 15-year-old Daniel Bridges. He confessed to other homicides of young men and boys in five separate states. Died of AIDS complications in 1994.","knife, stabbed, vehicle, truck, disemboweled",female,Blade
Larry Hall,,United States,2.0,50.0,14.0,1980.0,1994.0,Murder Kidnapping,life imprisonment without parole,"Hall traveled around the American Midwest as part of his interest in historical reenactments, which he would also use as a cover for stalking, raping, and murdering teenage girls. It is believed his first murders were committed when he was 18 years old. Although he was convicted of kidnapping 15-year-old Jessica Roach, Hall has never been charged with murder. Authorities have tied 15 murders to Hall, though only been able to confirm two, he has admitted to (and recanted) committing 39, though the FBI believes he could have committed as many as 50 in at least three states.","strangled, tortured",female,Strangulation
Lawrence Bittaker And Roy Norris,,United States,5.0,5.0,9.0,1979.0,1988.0,,,"The ""Toolbox Killers""; they kidnapped, raped, tortured and murdered five female hitchhikers in southern California over a five-month period in 1979.","stabbed, stabbing, car, vehicle",male,Blade
Lazaro Barbosa De Sousa,,Brazil,6.0,6.0,15.0,2006.0,2021.0,,,Convicted of a double murder in 2007; later escaped from prison and murdered a family of 4 before dying in a shootout with the police.,"firearm, shot, shooting, fire, car",male,Firearm
Lee Choon-Jae,,South Korea,15.0,15.0,8.0,1986.0,1994.0,,,"Also known as the Hwaseong serial murders. Most of the victims were bound, gagged, and strangled to death with their own clothes. It sparked the largest criminal case in South Korea with two million officers mobilized and over 21,000 suspects investigated. A suspect was identified in 2019, but he could not be prosecuted due to the statute of limitations. He later confessed to killing 15 people, in addition to the murder of his sister-in-law.","strangled, drowned",male,Strangulation
Lee Roy Martin,The Gaffney Strangler,United States,3.0,3.0,1.0,1967.0,1968.0,Murder,life imprisonment,"Known as ""The Gaffney Strangler""; killed two women and two girls in South Carolina in 1967 and 1968.","stabbed, strangled, car, vehicle",female,Blade
Lemuel Smith,,United States,6.0,6.0,23.0,1958.0,1981.0,,"death, commuted to Life","Confessed to the murders of five people, including an on-duty female prison guard. Sentenced to death on June 10, 1983. Commuted to life in 1984.","strangled, smothered, car, truck",male,Strangulation
Leon Dorsey,"Pistol Pete, The Blockbuster Killer",United States,3.0,3.0,9.0,1994.0,2003.0,Murder,"60 years (Chon murder), death(Lindsey and Armstrong murders)","Murdered three people from 4 April-11 September 1994. He was serving 60 years for the murder of an Ellis County convenience store employee when surveillance camera footage linked him to the murders of two other people. He was convicted and sentenced to death in June 2000, and executed on 12 August 2008.","gun, pistol, shot, stabbed",male,Firearm
Leonard Fraser,The Rockhampton Rapist,Australia,4.0,7.0,1.0,1998.0,1999.0,,5 × life imprisonment + 25 years,Serial rapist and pedophile who murdered four women in Rockhampton. Sentenced to five consecutive life sentences plus 25 years without the possibility of parole; died in prison of a heart attack in 2007.,unknown,male,Unknown
Leonard Lake And Charles Ng,,United States,11.0,25.0,3.0,1982.0,1985.0,,,"Abducted women, used them as sex slaves, and then murdered them, together with any men, women, and children who got in their way. Lake killed himself upon arrest, but Ng was later convicted of killing 11 people. Between 1982 and 1985, Lake and Ng were believed to have abducted and killed as many as 25 victims, as evidenced by human remains found on Lake's California ranch.","gun, firearm, pistol, shot, shooting, knife, cyanide, burned, explosives, hanging, car, tortured",male,Firearm
Leonarda Cianciulli,"The Soap-Maker of Correggio, (Italian: la Saponificatrice di Correggio)",Italy,3.0,3.0,1.0,1939.0,1940.0,,33 years of detention,"Murdered three women in the town of Correggio, Reggio Emilia, and turned their bodies into soap and cakes.",axe,female,Unknown
Leopold Dion,Monster of Pont-Rouge,Canada,4.0,4.0,9.0,1963.0,1972.0,Capital Murder,"death, commuted to life imprisonment","Known as the ""Monster of Port-Rouge"". Canadian sex offender and serial killer who was active in Quebec. Sentenced to hang but stabbed to death on November 17, 1972, by fellow inmate Normand ""Lawrence d'Arabie"" Champagne, who was found not guilty by reason of insanity.","stabbed, strangled, garrote, hanged, car",female,Blade
Leslie Irvin,"The Mad Dog Killer, Joe Goebbels",United States,6.0,6.0,1.0,1954.0,1955.0,Murder,"death, commuted to life imprisonment","Known as ""The Mad Dog Killer""; Killed six people in robberies in the mid-1950s; his Supreme Court case set a precedent for fair trials of highly publicized defendants.",shooting,male,Firearm
Leszek Pekalski,The Vampire of Bytów,Poland,1.0,17.0,8.0,1984.0,1992.0,Murder,,"Called ""The Vampire of Bytów"". Charged with 17 murders but convicted of only one (to 25 years in prison) for faulty collection of evidence. During the investigation he admitted to killing 80 people but later retracted his confession.",unknown,male,Unknown
Levi Bellfield,"Yusuf Rahim, The Bus Stop Stalker, The Bus Stop Killer The Hammer Man",United Kingdom,3.0,6.0,2.0,2002.0,2004.0,,,"West London serial killer convicted of two fatal hammer attacks on women and the murder of Milly Dowler. Also a suspect in the murders of his childhood girlfriend Patsy Morris in 1980, Judith Gold, who was hit over the head in 1990, and Elizabeth Chau, who disappeared in 1999 and whose murder Bellfield has allegedly confessed to.","strangled, strangulation, run over, car",male,Strangulation
Li Wenxiang,Guangzhou Ripper,China,13.0,13.0,5.0,1991.0,1996.0,"Murder, Rape, Robbery",deathsentence,"Known as ""The Guangzhou Ripper"". Killed 13 female sex workers in Guangzhou. Executed.",hammer,female,Blunt Object
Linda Hazzard,"Linda Burfield Hazzard, Starvation Doctor",United States,15.0,17.0,4.0,1908.0,1912.0,,,"Quack doctor and swindler who manipulated her patients into fasting until they starved themselves to death. 17 deaths were attributed to this practice, with evidence of 15 being presented at her trial. She was pardoned after serving two years imprisonment with hard labour and later starved herself to death attempting her own fasting cure.",burned,female,Fire
Lloyd Gomez,"Harry Jenks, The Phantom Hobo Killer, The Hobo Jungle Killer",United States,9.0,9.0,1.0,1950.0,1951.0,Murder,death,"Known as ""The Phantom Hobo Killer""; homeless man who killed other homeless men across California in the early 1950s.","gun, shot, shooting, knife, beat to death, car",male,Firearm
Long Island Serial Killer,,United States,10.0,16.0,14.0,1996.0,2010.0,,,"Unidentified serial killer also known as ""The Gilgo Beach Killer"". Believed to have murdered 10 to 14 people associated with the sex trade over a period of 15 years.","fire, drowning, vehicle",female,Vehicle
Long Zhimin And Yan Shuxia,,China,48.0,48.0,2.0,1983.0,1985.0,,,Shaanxi Province Wang Shou villagers Long Zhimin and Yan Shuxia in the home has killed 48 people.,unknown,male,Unknown
Lonnie David Franklin Jr.,Grim Sleeper25 Auto Killer,United States,10.0,25.0,22.0,1985.0,2007.0,Murder,death,"Known as the ""Grim Sleeper"" for the alleged 14-year hiatus he took from murdering between 1988 and 2002. Shot and strangled his victims, mostly women, around South Los Angeles. Sentenced to death. On March 28, 2020, Franklin was found dead in his cell.","gun, firearm, pistol, shot, knife, stabbing, car, vehicle",male,Firearm
Loren Herzog And Wesley Shermantine,,United States,4.0,19.0,15.0,1984.0,1999.0,,,"Known as the ""Speed Freak Killers""; California duo initially convicted of four murders from 1984 to 1999.","shot, shooting, knife, stabbed, stabbing, hanging, car, vehicle",male,Firearm
Lorenzo Gilyard,The Kansas City Strangler,United States,6.0,13.0,16.0,1977.0,1993.0,Murder,life imprisonment without parole,"Known as ""The Kansas City Strangler"". Killed up to 13 sex workers in the Kansas City area from 1977 to 1993. Sentenced to life in 2007.","stabbed, strangled, choked, bomb",female,Blade
Louay Omar Mohammed Al-Taei,,Iraq,43.0,43.0,1.0,2005.0,2006.0,,,"Medical doctor found to have killed 43 wounded policemen, soldiers and officials in Kirkuk; was a member of an insurgent cell.",unknown,male,Unknown
Louis Van Schoor,,South Africa,9.0,100.0,3.0,1986.0,1989.0,,,"Former security guard who was convicted of seven murders and two assassinations, but confessed to a reporter that he murdered 100 people; sentenced to 20 years in prison and released on parole in 2004.",unknown,male,Unknown
Louise Peete,"Louise M. Gould, Anna Lee",United States,3.0,3.0,30.0,1912.0,1942.0,Murder,life imprisonment(Denton murder) death(Logan murder),"Convicted of murdering a man and woman decades apart, four other acquaintances died suspiciously and four husbands committed suicide.","shot, strangled",female,Firearm
Lucy Letby,,United Kingdom,7.0,7.0,1.0,2015.0,2016.0,Murder,life imprisonment(whole life order),"Nurse convicted of murdering seven babies and attempting to murder another six while working at Countess of Chester Hospital in Chester, England.",unknown,female,Unknown
Ludivine Chambet,The Poisoner of Chambéry,France,10.0,10.0,1.0,2012.0,2013.0,Murder,25 years imprisonment + 10 years of involuntary commitment,"Known as ""The Poisoner of Chambéry""; nurse's aide who poisoned elderly patients; sentenced to 25 years imprisonment.",unknown,female,Unknown
Luis Garavito,"The Beast, Goofy, Conflict, Bonifacio Morera Lizcano",Colombia,193.0,247.0,7.0,1992.0,1999.0,,,"Child-murderer, torture-killer, and rapist known as ""La Bestia"" (""The Beast""). Garavito confessed to killing 140 boys between six and sixteen years old, from October 1992 to April 1999 in Colombia and neighboring countries. He is suspected of murdering over 300 victims, mostly street children. Garavito was originally sentenced to 1,853 years in prison, but this was later reduced to 22 years, after he led police to many of the bodies of his victims. He was scheduled to become eligible for parole in 2023. He died on October 12, 2023.","gun, revolver, razor, burned, tortured",male,Firearm
Luis Gregorio Ramirez Maestre,The Monster of Tenerife,Colombia,30.0,30.0,2.0,2010.0,2012.0,Murder,34 years in jail,Killed motorists in various municipalities before his 2012 capture. Was sentenced to 34 years in prison.,"suffocated, vehicle",male,Strangulation
Lyda Southard,"Lyda Anna Mae Trueblood, Flypaper Lyda, The Black Widow",United States,1.0,6.0,5.0,1915.0,1920.0,Murder,10 years to life in prison,"Suspected of killing her brother-in-law, four husbands and a daughter, but was only convicted of killing her fourth husband, Edward Meyer.",arsenic,female,Poison
M. Jaishankar,Psycho Shankar,India,19.0,19.0,3.0,2008.0,2011.0,"Murder, Rape",life imprisonment,"Accused of killing at least 19 women. Charged with 13 murders, he escaped during a trial transport. Killed eight more people in two months before he was recaptured. Sentenced to 27 years. Killed himself by slashing his wrists with a shaving blade in prison on 27 February 2018.","shooting, machete, truck",male,Firearm
Macario Alcala Canchola,Mexican Jack,Mexico,2.0,12.0,2.0,1960.0,1962.0,,"60 years in prison, maximum penalty in this time in Mexico City.","Known as ""Mexican Jack""; convicted of the murders of two sex workers but suspected of at least twelve more murders.",strangled,male,Strangulation
Mack Ray Edwards,,United States,6.0,6.0,17.0,1953.0,1970.0,Murder Kidnapping,death,Molester. Murdered 2 young girls and 4 young boys. Claimed at one point to have killed as many as 18.,"shooting, razor, hanged, hanging, car",male,Firearm
Mailoni Brothers,,Zambia,12.0,12.0,6.0,2007.0,2013.0,,,Three brothers who killed at least 12 people from 2007 to 2013. Killed by Zambia Army Commandos in 2013.,"shot, stabbed, axe, fire",male,Firearm
Maina Ramulu,,India,16.0,18.0,17.0,2003.0,2020.0,"Murder , Larceny , Escaping Police Custody",,"Convicted of murdering 16 women between 2003 and 2013 during three separate murder sprees. He was released from prison in 2020, and allegedly murdered two more women.",strangled,male,Strangulation
Majid Salek Mohammadi,,Iran,24.0,24.0,4.0,1981.0,1985.0,Murder,,"Killed mainly women he considered unfaithful to their husbands, sometimes the children accompanying them too; killed himself before he could be sentenced.",car,male,Vehicle
Manuel Delgado Villegas,"El Arropiero, El Estrangulador del Puerto",Spain,7.0,48.0,7.0,1964.0,1971.0,Murder Rape,Interned in a mental institution for life,"Wandering criminal known as El Arropiero (""The Arrope Trader"") and El Estrangulador del Puerto (""The Strangler of Puerto""). Confessed to the impulsive murders of 48 people of different sex, age, wealth and sexual orientation in three countries (including his girlfriend, whom he strangled during sex), but police only investigated him for 22 murders in Spain and was considered proven author of seven. Some of his victims were killed with hand to hand combat techniques that he had learned in the Spanish Foreign Legion. Diagnosed with XYY syndrome and interned in a mental institution until his death in 1998.","stabbed, blunt object, strangled, car",male,Blade
Manuel Octavio Bermudez,The Monster of the Cane Fields,Colombia,21.0,50.0,4.0,1999.0,2003.0,"Murder, Rape",25 years in prison,"Colombian child rapist and serial killer. Known as ""El Monstruo de los Cañaduzales"" (The Monster of the Cane Fields). He confessed to killing 21 children in remote areas of Colombia. Sentenced to 40 years in prison.","shooting, vehicle",male,Firearm
Marc Dutroux,,Belgium,5.0,5.0,1.0,1995.0,1996.0,"Child Pornography, Child Seual Abuse, Kidnapping, Murder, Theft",life imprisonment,Child molester who killed 4 of possibly 11 victims. He was also convicted for murdering one of his partners in crime.,"car, vehicle, truck, tortured",male,Vehicle
Marc Sappington,The Kansas City Vampire,United States,4.0,4.0,9.0,2001.0,2010.0,Murder Kidnapping,life imprisonment,Schizophrenic serial killer who heard voices telling him to kill after extended daily PCP use. He cannibalized part of his last victim.,"shooting, stabbing, car",male,Firearm
Marcel Petiot,"Captain Valery, Docteur Satan",France,26.0,63.0,18.0,1926.0,1944.0,Murder,death,Active 1926 and from 1942 to 1944. Petiot is suspected of having killed up to 63 in total. Executed in 1946.,"pistol, cyanide, injected, fire, grenade, car",male,Firearm
Marcelo Costa De Andrade,,Brazil,14.0,14.0,9.0,1991.0,2000.0,,,Known as The Vampire of Niterói. Raped and killed 14 children in Rio de Janeiro and Niterói. Drank the blood of his victims. Found not guilty by reason of insanity.,"strangled, drowning, decapitated",female,Strangulation
Marcelo De Jesus Silva And His Death Squad,,Brazil,20.0,20.0,4.0,2006.0,2010.0,,,"Brazilian man convicted of 20 counts of murder, robbery, drug trafficking and death squad. As he was only 1.28m tall, he was nicknamed Chucky and Pigmeu. Murdered in 2010 by rivals traffickers.","gun, hanging",male,Firearm
Mariam Soulakiotis,,Greece,27.0,177.0,12.0,1939.0,1951.0,,14 years in prison (died with pending criminal cases),"Known as ""Mother Rasputin""; abbess believed to have murdered wealthy women and children who came into her abbey. The true number of her victims is a matter of debate, but she was found guilty of 177 murders—150 through negligence (fraudulently claiming to offer free tuberculosis treatment when the 'treatment' only consisted of abiding in her high altitude convent) and 27 through starvation. Died in prison in 1954.",tortured,female,Torture
